{
 "schema_version": "1.0",
 "clip_id": "golden_022",
 "generated_at": "2026-09-30T03:31:25",
 "qc_mode": "tonight_replay",
 "verdict": {
  "defect_detected": true,
  "decision": "manual_review",
  "confidence": 0.8077,
  "decided_by": "E10",
  "reasons": [
   "E10 检出、未达 auto_reject 线：灰区人工复核（J3@0.70 触发[frame_freeze,color_shift] 最大P=0.808）"
  ]
 },
 "defects": [
  {
   "type": "frame_freeze",
   "sources": [
    "J3"
   ],
   "confidence": 0.8077,
   "evidence": {
    "J3": {
     "channel_probs": {
      "frame_freeze": 0.8077,
      "flicker": 0.1761,
      "color_shift": 0.8039,
      "face_blur": 0.0203,
      "garble_text": 0.0407,
      "temporal_swap": 0.2391,
      "pixelate": 0.3574,
      "ghosting": 0.4919
     },
     "overall": 0.4419
    }
   }
  },
  {
   "type": "color_shift",
   "sources": [
    "J3"
   ],
   "confidence": 0.8039,
   "evidence": {
    "J3": {
     "channel_probs": {
      "frame_freeze": 0.8077,
      "flicker": 0.1761,
      "color_shift": 0.8039,
      "face_blur": 0.0203,
      "garble_text": 0.0407,
      "temporal_swap": 0.2391,
      "pixelate": 0.3574,
      "ghosting": 0.4919
     },
     "overall": 0.4419
    }
   }
  },
  {
   "type": "garble_text",
   "sources": [
    "J6"
   ],
   "confidence": 0.7066428065299988,
   "evidence": {
    "J6": {
     "kind": "conf_drop",
     "conf_src": 0.707
    }
   },
   "span": {
    "start_s": 0.315,
    "end_s": 2.206
   }
  },
  {
   "type": "ghosting",
   "sources": [
    "J2"
   ],
   "confidence": 0.6,
   "evidence": {
    "J2": {
     "notes": "中帧相比首尾帧细节明显丢失、呈邻帧混合的双重曝光质感，符合拖影/帧混合特征，但静帧下与运动模糊难完全区分故置信度中等"
    }
   }
  }
 ],
 "scores": {
  "per_type": {
   "frame_freeze": 0.8077,
   "flicker": 0.1761,
   "color_shift": 0.8039,
   "face_blur": 0.0203,
   "garble_text": 0.0407,
   "temporal_swap": 0.2391,
   "pixelate": 0.3574,
   "ghosting": 0.4919
  },
  "overall": 0.4419,
  "thresholds_applied": {
   "ensemble_id": "E10",
   "j3_thr": 0.7,
   "auto_reject_p": 0.9,
   "j6_emit_conf": 0.55,
   "thresholds_sha256": "d39953c05717cdcdeb22b2d586c035538c64c4adf1fb13e671ea4e5a154ae0fd"
  }
 },
 "spans": [
  {
   "type": "note",
   "evidence": {
    "text": "f01–f08 全程检查",
    "source": "J1"
   }
  },
  {
   "type": "note",
   "evidence": {
    "text": "f05（约片中段）：整画面云层与山地纹理变软发虚",
    "source": "J2"
   }
  },
  {
   "type": "note",
   "evidence": {
    "text": "full_clip:fps=1.0解码",
    "source": "J5"
   }
  }
 ],
 "judges": {
  "J1": {
   "clip_id": "golden_022",
   "defect_detected": false,
   "defect_types": [],
   "confidence": 0.55,
   "spans": "f01–f08 全程检查",
   "notes": "云雾山谷航拍慢速漂移：8帧亮度117.3→107.0、饱和度41.4→51.4严格单调（排除段落错乱/定格/闪烁阶跃），全局与局部Laplacian方差无中段凹陷，帧间差3.3→5.6平滑升降；目视与数值均未见拖影证据。慢速雾景下轻微tblend拖影在静帧中接近不可检，故置信度仅中等"
  },
  "J2": {
   "clip_id": "golden_022",
   "defect_detected": true,
   "defect_types": [
    "ghosting"
   ],
   "confidence": 0.6,
   "spans": "f05（约片中段）：整画面云层与山地纹理变软发虚",
   "notes": "中帧相比首尾帧细节明显丢失、呈邻帧混合的双重曝光质感，符合拖影/帧混合特征，但静帧下与运动模糊难完全区分故置信度中等"
  },
  "J5": {
   "clip_id": "golden_022",
   "defect_detected": false,
   "defect_types": [],
   "confidence": 0.8,
   "spans": "full_clip:fps=1.0解码",
   "notes": "解析=json; 回答={\"defect_types\":[],\"other\":false,\"reason\":\"画面中没有出现任何缺陷\"}"
  },
  "J6": {
   "clip_id": "golden_022",
   "defect_detected": true,
   "defect_types": [
    "garble_text"
   ],
   "confidence": 0.707,
   "spans": [
    {
     "type": "garble_text",
     "start_s": 0.315,
     "end_s": 2.206,
     "evidence": {
      "kind": "conf_drop",
      "drop": 0.353,
      "frames": [
       0,
       3
      ],
      "mean_scores": [
       0.421,
       0.774
      ]
     }
    }
   ]
  },
  "J3": {
   "clip_id": "golden_022",
   "defect_detected": true,
   "defect_types": [
    "frame_freeze",
    "color_shift"
   ],
   "confidence": 0.8077,
   "spans": "16帧4x4拼图 9通道概率（run_metadata.json），阈值 0.70",
   "notes": "frame_freeze=0.808; flicker=0.176; color_shift=0.804; face_blur=0.020; garble_text=0.041; temporal_swap=0.239; pixelate=0.357; ghosting=0.492; overall=0.442"
  }
 },
 "inputs": {
  "clip": null,
  "frames_dir": null,
  "judge_files": {
   "J1": "..\\数据\\judges\\glm8\\golden_022.json",
   "J2": "..\\数据\\judges\\glm3\\golden_022.json",
   "J5": "..\\数据\\judges\\videochat3\\golden_022.json",
   "J6": "..\\数据\\judges\\detectors\\golden_022.json",
   "J3": "..\\数据\\judges\\omnijev\\run_metadata.json"
  }
 },
 "errors": {}
}