{
 "schema_version": "1.0",
 "clip_id": "golden_026",
 "generated_at": "2026-09-30T18:07:34",
 "qc_mode": "tonight_replay",
 "verdict": {
  "defect_detected": false,
  "decision": "pass",
  "confidence": 0.0,
  "decided_by": "E10",
  "reasons": [
   "E10 未触发：J1 未检出且 J3 无通道 P>0.70"
  ]
 },
 "defects": [
  {
   "type": "color_shift",
   "sources": [
    "J6"
   ],
   "confidence": 1.0,
   "evidence": {
    "J6": {
     "kind": "hue_shift",
     "conf_src": 1.0
    }
   },
   "span": {
    "start_s": 1.615,
    "end_s": 2.261
   }
  },
  {
   "type": "temporal_swap",
   "sources": [
    "J6"
   ],
   "confidence": 0.75,
   "evidence": {
    "J6": {
     "kind": "scene_cut_mid",
     "conf_src": 0.75
    }
   },
   "span": {
    "start_s": 1.208,
    "end_s": 2.208
   }
  }
 ],
 "scores": {
  "per_type": {
   "frame_freeze": 0.411,
   "flicker": 0.3826,
   "color_shift": 0.5433,
   "face_blur": 0.1239,
   "garble_text": 0.0406,
   "temporal_swap": 0.4381,
   "pixelate": 0.077,
   "ghosting": 0.3867
  },
  "overall": 0.4833,
  "thresholds_applied": {
   "ensemble_id": "E10",
   "j3_thr": 0.7,
   "auto_reject_p": 0.9,
   "j6_emit_conf": 0.55,
   "thresholds_sha256": "28f192cae0562f89f46a419b768d965aaf1d9298f6678eedfd93d63d2bb06f00"
  }
 },
 "spans": [
  {
   "type": "note",
   "evidence": {
    "text": "f04-f05（约中段）",
    "source": "J1"
   }
  },
  {
   "type": "note",
   "evidence": {
    "text": "f01/f05/f08",
    "source": "J2"
   }
  },
  {
   "type": "note",
   "evidence": {
    "text": "full_clip:fps=1.0解码",
    "source": "J5"
   }
  }
 ],
 "judges": {
  "J1": {
   "clip_id": "golden_026",
   "defect_detected": false,
   "defect_types": [],
   "confidence": 0.7,
   "spans": "f04-f05（约中段）",
   "notes": "f01-f03红裙女子侧面、f04-f05反打蓝西装男子、f06-f08回女子正面捋发，正反打剪辑连续自然，无冻结/闪烁/糊脸"
  },
  "J2": {
   "clip_id": "golden_026",
   "defect_detected": false,
   "defect_types": [],
   "confidence": 0.8,
   "spans": "f01/f05/f08",
   "notes": "咖啡馆对话正反打镜头切换（红裙女子与西装男子），两人脸均清晰且各自身份一致，无可疑伪影"
  },
  "J5": {
   "clip_id": "golden_026",
   "defect_detected": false,
   "defect_types": [],
   "confidence": 0.8,
   "spans": "full_clip:fps=1.0解码",
   "notes": "解析=json; 回答={\"defect_types\":[],\"other\":false,\"reason\":\"画面中人物动作自然流畅，无明显定格、闪烁、偏色、模糊、乱码、时序错乱、像素化或拖影现象\"}"
  },
  "J6": {
   "clip_id": "golden_026",
   "defect_detected": true,
   "defect_types": [
    "color_shift",
    "temporal_swap"
   ],
   "confidence": 1.0,
   "spans": [
    {
     "type": "color_shift",
     "start_s": 1.615,
     "end_s": 2.26,
     "evidence": {
      "kind": "hue_shift",
      "pair": 2,
      "hue_delta_deg": 96.0
     }
    },
    {
     "type": "temporal_swap",
     "start_s": 1.208,
     "end_s": 2.208,
     "evidence": {
      "cut_s": 1.708,
      "kind": "scene_cut_mid"
     }
    }
   ]
  },
  "J3": {
   "clip_id": "golden_026",
   "defect_detected": false,
   "defect_types": [],
   "confidence": 0.5433,
   "spans": "16帧4x4拼图 9通道概率（run_metadata.json），阈值 0.70",
   "notes": "frame_freeze=0.411; flicker=0.383; color_shift=0.543; face_blur=0.124; garble_text=0.041; temporal_swap=0.438; pixelate=0.077; ghosting=0.387; overall=0.483"
  }
 },
 "inputs": {
  "clip": null,
  "frames_dir": null,
  "judge_files": {
   "J1": "D:\\workspace\\video-capability-research\\overnight\\数据\\judges\\glm8\\golden_026.json",
   "J2": "D:\\workspace\\video-capability-research\\overnight\\数据\\judges\\glm3\\golden_026.json",
   "J5": "D:\\workspace\\video-capability-research\\overnight\\数据\\judges\\videochat3\\golden_026.json",
   "J6": "D:\\workspace\\video-capability-research\\overnight\\数据\\judges\\detectors\\golden_026.json",
   "J3": "D:\\workspace\\video-capability-research\\overnight\\数据\\judges\\omnijev\\run_metadata.json"
  }
 },
 "errors": {}
}