{
 "schema_version": "1.0",
 "clip_id": "golden_019",
 "generated_at": "2026-09-30T18:07:34",
 "qc_mode": "tonight_replay",
 "verdict": {
  "defect_detected": true,
  "decision": "manual_review",
  "confidence": 0.85,
  "decided_by": "E10",
  "reasons": [
   "E10 检出、未达 auto_reject 线：灰区人工复核（J1 检出（无概率通道≥0.90））"
  ]
 },
 "defects": [
  {
   "type": "identity_drift",
   "sources": [
    "J1"
   ],
   "confidence": 0.85,
   "evidence": {
    "J1": {
     "notes": "放大比对证实尚未倒下的后排骨牌颜色顺序逐帧突变（f03 G,B,R→f04 G,R,Y→f05 G,R,B→f06 Y,G），静态物体颜色/身份跨帧不一致；倒下运动本身方向一致、链式走完。对照源prompt（G4-20：二十张骨牌）：首张与末张均在片中出现、可见骨牌总数仅约8张，数量严重不足。"
    }
   }
  },
  {
   "type": "count_error",
   "sources": [
    "J1"
   ],
   "confidence": 0.85,
   "evidence": {
    "J1": {
     "notes": "放大比对证实尚未倒下的后排骨牌颜色顺序逐帧突变（f03 G,B,R→f04 G,R,Y→f05 G,R,B→f06 Y,G），静态物体颜色/身份跨帧不一致；倒下运动本身方向一致、链式走完。对照源prompt（G4-20：二十张骨牌）：首张与末张均在片中出现、可见骨牌总数仅约8张，数量严重不足。"
    }
   }
  }
 ],
 "scores": {
  "per_type": {
   "frame_freeze": 0.5555,
   "flicker": 0.3557,
   "color_shift": 0.2391,
   "face_blur": 0.1385,
   "garble_text": 0.0389,
   "temporal_swap": 0.2474,
   "pixelate": 0.1109,
   "ghosting": 0.3201
  },
  "overall": 0.4169,
  "thresholds_applied": {
   "ensemble_id": "E10",
   "j3_thr": 0.7,
   "auto_reject_p": 0.9,
   "j6_emit_conf": 0.55,
   "thresholds_sha256": "28f192cae0562f89f46a419b768d965aaf1d9298f6678eedfd93d63d2bb06f00"
  }
 },
 "spans": [
  {
   "type": "note",
   "evidence": {
    "text": "identity_drift：f03-f06（约1.9s-3.8s）后排未倒骨牌区；count_error：全片",
    "source": "J1"
   }
  },
  {
   "type": "note",
   "evidence": {
    "text": "f01/f05/f08",
    "source": "J2"
   }
  },
  {
   "type": "note",
   "evidence": {
    "text": "full_clip:fps=1.0解码",
    "source": "J5"
   }
  }
 ],
 "judges": {
  "J1": {
   "clip_id": "golden_019",
   "defect_detected": true,
   "defect_types": [
    "identity_drift",
    "count_error"
   ],
   "confidence": 0.85,
   "spans": "identity_drift：f03-f06（约1.9s-3.8s）后排未倒骨牌区；count_error：全片",
   "notes": "放大比对证实尚未倒下的后排骨牌颜色顺序逐帧突变（f03 G,B,R→f04 G,R,Y→f05 G,R,B→f06 Y,G），静态物体颜色/身份跨帧不一致；倒下运动本身方向一致、链式走完。对照源prompt（G4-20：二十张骨牌）：首张与末张均在片中出现、可见骨牌总数仅约8张，数量严重不足。"
  },
  "J2": {
   "clip_id": "golden_019",
   "defect_detected": false,
   "defect_types": [],
   "confidence": 0.4,
   "spans": "f01/f05/f08",
   "notes": "骨牌推倒过程动态连贯无物理穿帮；可见骨牌总数约5-6张，缺少 prompt 无法判定数量是否违约"
  },
  "J5": {
   "clip_id": "golden_019",
   "defect_detected": false,
   "defect_types": [],
   "confidence": 0.8,
   "spans": "full_clip:fps=1.0解码",
   "notes": "解析=json; 回答={\"defect_types\":[],\"other\":false,\"reason\":\"画面中没有出现任何缺陷\"}"
  },
  "J6": {
   "clip_id": "golden_019",
   "defect_detected": true,
   "defect_types": [
    "garble_text"
   ],
   "confidence": 0.548,
   "spans": [
    {
     "type": "garble_text",
     "start_s": 2.26,
     "end_s": 2.906,
     "evidence": {
      "kind": "conf_drop",
      "drop": 0.274,
      "frames": [
       3,
       4
      ],
      "mean_scores": [
       0.349,
       0.623
      ]
     }
    }
   ]
  },
  "J3": {
   "clip_id": "golden_019",
   "defect_detected": false,
   "defect_types": [],
   "confidence": 0.5555,
   "spans": "16帧4x4拼图 9通道概率（run_metadata.json），阈值 0.70",
   "notes": "frame_freeze=0.555; flicker=0.356; color_shift=0.239; face_blur=0.139; garble_text=0.039; temporal_swap=0.247; pixelate=0.111; ghosting=0.320; overall=0.417"
  }
 },
 "inputs": {
  "clip": null,
  "frames_dir": null,
  "judge_files": {
   "J1": "D:\\workspace\\video-capability-research\\overnight\\数据\\judges\\glm8\\golden_019.json",
   "J2": "D:\\workspace\\video-capability-research\\overnight\\数据\\judges\\glm3\\golden_019.json",
   "J5": "D:\\workspace\\video-capability-research\\overnight\\数据\\judges\\videochat3\\golden_019.json",
   "J6": "D:\\workspace\\video-capability-research\\overnight\\数据\\judges\\detectors\\golden_019.json",
   "J3": "D:\\workspace\\video-capability-research\\overnight\\数据\\judges\\omnijev\\run_metadata.json"
  }
 },
 "errors": {}
}