{
 "schema_version": "1.0",
 "clip_id": "golden_031",
 "generated_at": "2026-09-30T03:31:25",
 "qc_mode": "tonight_replay",
 "verdict": {
  "defect_detected": true,
  "decision": "manual_review",
  "confidence": 0.6,
  "decided_by": "E10",
  "reasons": [
   "E10 检出、未达 auto_reject 线：灰区人工复核（J1 检出（无概率通道≥0.90））"
  ]
 },
 "defects": [
  {
   "type": "count_error",
   "sources": [
    "J1"
   ],
   "confidence": 0.6,
   "evidence": {
    "J1": {
     "notes": "8帧均为数十个完全相同的蓝色方块瓷砖状密铺（可见约40+个），对象过度重复疑似计数异常；帧间无定格/闪烁/色偏/糊化等注入伪影，但是否违背prompt数量盲测下无法确证。"
    }
   }
  }
 ],
 "scores": {
  "per_type": {
   "frame_freeze": 0.5977,
   "flicker": 0.244,
   "color_shift": 0.3186,
   "face_blur": 0.0261,
   "garble_text": 0.041,
   "temporal_swap": 0.2799,
   "pixelate": 0.5863,
   "ghosting": 0.2819
  },
  "overall": 0.5257,
  "thresholds_applied": {
   "ensemble_id": "E10",
   "j3_thr": 0.7,
   "auto_reject_p": 0.9,
   "j6_emit_conf": 0.55,
   "thresholds_sha256": "d39953c05717cdcdeb22b2d586c035538c64c4adf1fb13e671ea4e5a154ae0fd"
  }
 },
 "spans": [
  {
   "type": "note",
   "evidence": {
    "text": "全片 f01-f08",
    "source": "J1"
   }
  },
  {
   "type": "note",
   "evidence": {
    "text": "f01/f05/f08",
    "source": "J2"
   }
  },
  {
   "type": "note",
   "evidence": {
    "text": "full_clip:fps=1.0解码",
    "source": "J5"
   }
  }
 ],
 "judges": {
  "J1": {
   "clip_id": "golden_031",
   "defect_detected": true,
   "defect_types": [
    "count_error"
   ],
   "confidence": 0.6,
   "spans": "全片 f01-f08",
   "notes": "8帧均为数十个完全相同的蓝色方块瓷砖状密铺（可见约40+个），对象过度重复疑似计数异常；帧间无定格/闪烁/色偏/糊化等注入伪影，但是否违背prompt数量盲测下无法确证。"
  },
  "J2": {
   "clip_id": "golden_031",
   "defect_detected": false,
   "defect_types": [],
   "confidence": 0.3,
   "spans": "f01/f05/f08",
   "notes": "蓝色方块瓷砖阵列三帧稳定无伪影，可见方块数十个；缺少 prompt 无法判定数量/物体类别是否违约"
  },
  "J5": {
   "clip_id": "golden_031",
   "defect_detected": false,
   "defect_types": [],
   "confidence": 0.8,
   "spans": "full_clip:fps=1.0解码",
   "notes": "解析=json; 回答={\"defect_types\":[],\"other\":false,\"reason\":\"画面中无明显缺陷\"}"
  },
  "J6": {
   "clip_id": "golden_031",
   "defect_detected": false,
   "defect_types": [],
   "confidence": 1.0,
   "spans": []
  },
  "J3": {
   "clip_id": "golden_031",
   "defect_detected": false,
   "defect_types": [],
   "confidence": 0.5977,
   "spans": "16帧4x4拼图 9通道概率（run_metadata.json），阈值 0.70",
   "notes": "frame_freeze=0.598; flicker=0.244; color_shift=0.319; face_blur=0.026; garble_text=0.041; temporal_swap=0.280; pixelate=0.586; ghosting=0.282; overall=0.526"
  }
 },
 "inputs": {
  "clip": null,
  "frames_dir": null,
  "judge_files": {
   "J1": "..\\数据\\judges\\glm8\\golden_031.json",
   "J2": "..\\数据\\judges\\glm3\\golden_031.json",
   "J5": "..\\数据\\judges\\videochat3\\golden_031.json",
   "J6": "..\\数据\\judges\\detectors\\golden_031.json",
   "J3": "..\\数据\\judges\\omnijev\\run_metadata.json"
  }
 },
 "errors": {}
}