{
 "schema_version": "1.0",
 "clip_id": "golden_008",
 "generated_at": "2026-10-01T18:08:09",
 "qc_mode": "tonight_replay",
 "verdict": {
  "defect_detected": true,
  "decision": "manual_review",
  "confidence": 0.8694,
  "decided_by": "E10",
  "reasons": [
   "E10 检出、未达 auto_reject 线：灰区人工复核（J3@0.70 触发[frame_freeze] 最大P=0.869）"
  ]
 },
 "defects": [
  {
   "type": "frame_freeze",
   "sources": [
    "J3"
   ],
   "confidence": 0.8694,
   "evidence": {
    "J3": {
     "channel_probs": {
      "frame_freeze": 0.8694,
      "flicker": 0.1596,
      "color_shift": 0.5704,
      "face_blur": 0.1967,
      "garble_text": 0.0421,
      "temporal_swap": 0.3144,
      "pixelate": 0.193,
      "ghosting": 0.3184
     },
     "overall": 0.5979
    }
   }
  }
 ],
 "scores": {
  "per_type": {
   "frame_freeze": 0.8694,
   "flicker": 0.1596,
   "color_shift": 0.5704,
   "face_blur": 0.1967,
   "garble_text": 0.0421,
   "temporal_swap": 0.3144,
   "pixelate": 0.193,
   "ghosting": 0.3184
  },
  "overall": 0.5979,
  "thresholds_applied": {
   "ensemble_id": "E10",
   "j3_thr": 0.7,
   "auto_reject_p": 0.9,
   "j6_emit_conf": 0.55,
   "thresholds_sha256": "f5d1e6512c18745e9dcdc1e0a20aab5fb29902acf57ee3956b995a42e3ff9be0"
  }
 },
 "spans": [
  {
   "type": "note",
   "evidence": {
    "text": "全片 f01-f08（0-5.0s）",
    "source": "J1"
   }
  },
  {
   "type": "note",
   "evidence": {
    "text": "f01/f05/f08",
    "source": "J2"
   }
  },
  {
   "type": "note",
   "evidence": {
    "text": "full_clip:fps=1.0解码",
    "source": "J5"
   }
  }
 ],
 "judges": {
  "J1": {
   "clip_id": "golden_008",
   "defect_detected": false,
   "defect_types": [],
   "confidence": 0.6,
   "spans": "全片 f01-f08（0-5.0s）",
   "notes": "机器人下弯-起身姿态弧线单调连续，场景物件无瞬移，8帧抽样下未见段落错乱的时间回跳；注：temporal_swap若两段内容相似在8帧下不可见，置信度受限"
  },
  "J2": {
   "clip_id": "golden_008",
   "defect_detected": false,
   "defect_types": [],
   "confidence": 0.45,
   "spans": "f01/f05/f08",
   "notes": "机器人工作台场景三帧一致，物体/光照稳定无可见缺陷；静帧无法验证段落时序错乱"
  },
  "J5": {
   "clip_id": "golden_008",
   "defect_detected": false,
   "defect_types": [],
   "confidence": 0.8,
   "spans": "full_clip:fps=1.0解码",
   "notes": "解析=json; 回答={\"defect_types\":[],\"other\":false,\"reason\":\"画面中机器人动作流畅，无定格、闪烁、偏色、模糊、乱码、错乱、像素化或拖影等明显缺陷\"}"
  },
  "J6": {
   "clip_id": "golden_008",
   "defect_detected": false,
   "defect_types": [],
   "confidence": 1.0,
   "spans": []
  },
  "J3": {
   "clip_id": "golden_008",
   "defect_detected": true,
   "defect_types": [
    "frame_freeze"
   ],
   "confidence": 0.8694,
   "spans": "16帧4x4拼图 9通道概率（run_metadata.json），阈值 0.70",
   "notes": "frame_freeze=0.869; flicker=0.160; color_shift=0.570; face_blur=0.197; garble_text=0.042; temporal_swap=0.314; pixelate=0.193; ghosting=0.318; overall=0.598"
  }
 },
 "inputs": {
  "clip": null,
  "frames_dir": null,
  "judge_files": {
   "J1": "/opt/gpumachine/projects/video-capability/overnight/数据/judges/glm8/golden_008.json",
   "J2": "/opt/gpumachine/projects/video-capability/overnight/数据/judges/glm3/golden_008.json",
   "J5": "/opt/gpumachine/projects/video-capability/overnight/数据/judges/videochat3/golden_008.json",
   "J6": "/opt/gpumachine/projects/video-capability/overnight/数据/judges/detectors/golden_008.json",
   "J3": "/opt/gpumachine/projects/video-capability/overnight/数据/judges/omnijev/run_metadata.json"
  }
 },
 "errors": {}
}