{
 "schema_version": "1.0",
 "clip_id": "golden_032",
 "generated_at": "2026-09-30T18:07:34",
 "qc_mode": "tonight_replay",
 "verdict": {
  "defect_detected": true,
  "decision": "manual_review",
  "confidence": 0.8969,
  "decided_by": "E10",
  "reasons": [
   "E10 检出、未达 auto_reject 线：灰区人工复核（J3@0.70 触发[color_shift,ghosting] 最大P=0.897）"
  ]
 },
 "defects": [
  {
   "type": "color_shift",
   "sources": [
    "J3",
    "J6"
   ],
   "confidence": 1.0,
   "evidence": {
    "J3": {
     "channel_probs": {
      "frame_freeze": 0.0437,
      "flicker": 0.4552,
      "color_shift": 0.716,
      "face_blur": 0.3269,
      "garble_text": 0.1358,
      "temporal_swap": 0.4457,
      "pixelate": 0.216,
      "ghosting": 0.8969
     },
     "overall": 0.5938
    },
    "J6": {
     "kind": "hue_shift",
     "conf_src": 1.0
    }
   },
   "span": {
    "start_s": 0.969,
    "end_s": 1.615
   }
  },
  {
   "type": "garble_text",
   "sources": [
    "J6"
   ],
   "confidence": 1.0,
   "evidence": {
    "J6": {
     "kind": "conf_drop",
     "conf_src": 1.0
    }
   },
   "span": {
    "start_s": 1.615,
    "end_s": 4.844
   }
  },
  {
   "type": "identity_drift",
   "sources": [
    "J6"
   ],
   "confidence": 1.0,
   "evidence": {
    "J6": {
     "kind": null,
     "conf_src": 1.0
    }
   },
   "span": {
    "start_s": 0.969,
    "end_s": 1.615
   }
  },
  {
   "type": "ghosting",
   "sources": [
    "J3"
   ],
   "confidence": 0.8969,
   "evidence": {
    "J3": {
     "channel_probs": {
      "frame_freeze": 0.0437,
      "flicker": 0.4552,
      "color_shift": 0.716,
      "face_blur": 0.3269,
      "garble_text": 0.1358,
      "temporal_swap": 0.4457,
      "pixelate": 0.216,
      "ghosting": 0.8969
     },
     "overall": 0.5938
    }
   }
  },
  {
   "type": "face_blur",
   "sources": [
    "J6"
   ],
   "confidence": 0.5807389318943024,
   "evidence": {
    "J6": {
     "kind": null,
     "conf_src": 0.581
    }
   },
   "span": {
    "start_s": 0.323,
    "end_s": 0.969
   }
  }
 ],
 "scores": {
  "per_type": {
   "frame_freeze": 0.0437,
   "flicker": 0.4552,
   "color_shift": 0.716,
   "face_blur": 0.3269,
   "garble_text": 0.1358,
   "temporal_swap": 0.4457,
   "pixelate": 0.216,
   "ghosting": 0.8969
  },
  "overall": 0.5938,
  "thresholds_applied": {
   "ensemble_id": "E10",
   "j3_thr": 0.7,
   "auto_reject_p": 0.9,
   "j6_emit_conf": 0.55,
   "thresholds_sha256": "28f192cae0562f89f46a419b768d965aaf1d9298f6678eedfd93d63d2bb06f00"
  }
 },
 "spans": [
  {
   "type": "note",
   "evidence": {
    "text": "全片 f01-f08",
    "source": "J1"
   }
  },
  {
   "type": "note",
   "evidence": {
    "text": "f01/f05/f08",
    "source": "J2"
   }
  },
  {
   "type": "note",
   "evidence": {
    "text": "full_clip:fps=1.0解码",
    "source": "J5"
   }
  }
 ],
 "judges": {
  "J1": {
   "clip_id": "golden_032",
   "defect_detected": false,
   "defect_types": [],
   "confidence": 0.7,
   "spans": "全片 f01-f08",
   "notes": "夜市街景：黄衣跑者f03-f08身份/服装一致、跑步姿态连贯，霓虹牌NOODLES英文正确，行人前景模糊属自然运动模糊，未见定格/闪烁/色偏/区域糊化/像素化/拖影等缺陷。"
  },
  "J2": {
   "clip_id": "golden_032",
   "defect_detected": false,
   "defect_types": [],
   "confidence": 0.55,
   "spans": "f01/f05/f08",
   "notes": "夜市行人/跑者场景主体与路人构成自洽，夜景运动模糊属正常；招牌小字景深模糊无法核读乱码"
  },
  "J5": {
   "clip_id": "golden_032",
   "defect_detected": false,
   "defect_types": [],
   "confidence": 0.8,
   "spans": "full_clip:fps=1.0解码",
   "notes": "解析=json; 回答={\"defect_types\":[],\"other\":false,\"reason\":\"画面中无明显缺陷\"}"
  },
  "J6": {
   "clip_id": "golden_032",
   "defect_detected": true,
   "defect_types": [
    "identity_drift",
    "garble_text",
    "color_shift",
    "face_blur"
   ],
   "confidence": 1.0,
   "spans": [
    {
     "type": "identity_drift",
     "start_s": 0.969,
     "end_s": 1.615,
     "evidence": {
      "pair": 1,
      "cos": -0.0426
     }
    },
    {
     "type": "garble_text",
     "start_s": 1.615,
     "end_s": 4.844,
     "evidence": {
      "kind": "conf_drop",
      "drop": 0.894,
      "frames": [
       7,
       2
      ],
      "mean_scores": [
       0.106,
       1.0
      ]
     }
    },
    {
     "type": "color_shift",
     "start_s": 0.969,
     "end_s": 1.615,
     "evidence": {
      "kind": "hue_shift",
      "pair": 1,
      "hue_delta_deg": 157.4
     }
    },
    {
     "type": "face_blur",
     "start_s": 0.323,
     "end_s": 0.969,
     "evidence": {
      "pair": 0,
      "cos": 0.3839
     }
    }
   ]
  },
  "J3": {
   "clip_id": "golden_032",
   "defect_detected": true,
   "defect_types": [
    "color_shift",
    "ghosting"
   ],
   "confidence": 0.8969,
   "spans": "16帧4x4拼图 9通道概率（run_metadata.json），阈值 0.70",
   "notes": "frame_freeze=0.044; flicker=0.455; color_shift=0.716; face_blur=0.327; garble_text=0.136; temporal_swap=0.446; pixelate=0.216; ghosting=0.897; overall=0.594"
  }
 },
 "inputs": {
  "clip": null,
  "frames_dir": null,
  "judge_files": {
   "J1": "D:\\workspace\\video-capability-research\\overnight\\数据\\judges\\glm8\\golden_032.json",
   "J2": "D:\\workspace\\video-capability-research\\overnight\\数据\\judges\\glm3\\golden_032.json",
   "J5": "D:\\workspace\\video-capability-research\\overnight\\数据\\judges\\videochat3\\golden_032.json",
   "J6": "D:\\workspace\\video-capability-research\\overnight\\数据\\judges\\detectors\\golden_032.json",
   "J3": "D:\\workspace\\video-capability-research\\overnight\\数据\\judges\\omnijev\\run_metadata.json"
  }
 },
 "errors": {}
}