{
 "schema_version": "1.1",
 "clip_id": "golden_028",
 "generated_at": "2026-10-01T18:08:08",
 "qc_mode": "tonight_replay",
 "verdict": {
  "defect_detected": true,
  "decision": "manual_review",
  "confidence": 0.7769,
  "decided_by": "E10:J1.detected OR J3@0.70 flag",
  "reasons": [
   "J1(detected=False, types=[], conf=0.8)",
   "J3@0.7 flag=True hits=['frame_freeze'] max_channel_P=0.7769",
   "J6 信号(仅信号不否决): temporal_swap@0.75"
  ]
 },
 "defects": [
  {
   "type": "frame_freeze",
   "sources": [
    "J3"
   ],
   "confidence": 0.7769,
   "evidence": {
    "J3": {
     "channel_P": 0.7769
    }
   }
  },
  {
   "type": "temporal_swap",
   "sources": [
    "J6"
   ],
   "confidence": 0.75,
   "span": {
    "start_s": 4.54,
    "end_s": 5.54
   },
   "evidence": {
    "J6": {
     "cut_s": 5.04
    }
   }
  }
 ],
 "scores": {
  "per_type": {
   "frame_freeze": 0.7769,
   "flicker": 0.4401,
   "color_shift": 0.627,
   "face_blur": 0.0297,
   "garble_text": 0.038,
   "temporal_swap": 0.3556,
   "pixelate": 0.5814,
   "ghosting": 0.6678
  },
  "overall": 0.521,
  "thresholds_applied": {
   "ensemble_id": "E10",
   "j3_thr": 0.7,
   "auto_reject_p": 0.9,
   "j6_emit_conf": 0.55,
   "thresholds_sha256": "f5d1e6512c18745e9dcdc1e0a20aab5fb29902acf57ee3956b995a42e3ff9be0"
  }
 },
 "spans": [
  {
   "type": "temporal_swap",
   "start_s": 4.54,
   "end_s": 5.54,
   "evidence": {
    "cut_s": 5.04
   }
  },
  {
   "type": "note",
   "evidence": {
    "judge": "J1",
    "text": "全片"
   }
  },
  {
   "type": "note",
   "evidence": {
    "judge": "J3",
    "text": "full_clip:16帧均匀采样4x4拼图"
   }
  },
  {
   "type": "note",
   "evidence": {
    "judge": "J5",
    "text": "full_clip:fps=1.0解码"
   }
  }
 ],
 "judges": {
  "J1": {
   "clip_id": "golden_028",
   "defect_detected": false,
   "defect_types": [],
   "confidence": 0.8,
   "spans": "全片",
   "notes": "月季花丛缓慢平移，相邻帧MAD 21-32均有真实位移无定格，色彩曝光稳定"
  },
  "J5": {
   "clip_id": "golden_028",
   "defect_detected": false,
   "defect_types": [],
   "confidence": 0.8,
   "spans": "full_clip:fps=1.0解码",
   "notes": "解析=json; 回答={\"defect_types\":[],\"other\":false,\"reason\":\"画面中没有出现任何缺陷\"}"
  },
  "J3": {
   "clip_id": "golden_028",
   "defect_detected": true,
   "defect_types": [
    "frame_freeze",
    "color_shift",
    "pixelate",
    "ghosting"
   ],
   "confidence": 0.7769,
   "spans": "full_clip:16帧均匀采样4x4拼图",
   "notes": "noul概率 frame_freeze=0.777 flicker=0.440 color_shift=0.627 face_blur=0.030 garble_text=0.038 temporal_swap=0.356 pixelate=0.581 ghosting=0.668; overall=0.521; 阈值0.5; 16帧4x4时间戳拼图整体判定"
  },
  "J6": {
   "clip_id": "golden_028",
   "defect_detected": true,
   "defect_types": [
    "temporal_swap"
   ],
   "confidence": 0.75,
   "spans": [
    {
     "type": "temporal_swap",
     "start_s": 4.54,
     "end_s": 5.54,
     "evidence": {
      "cut_s": 5.04
     }
    }
   ],
   "notes": "qc_orch_v2 规则引擎重建（阈值=/opt/gpumachine/projects/video-capability/overnight/vpipe/eval/thresholds.yaml emit@0.55）"
  }
 },
 "inputs": {
  "clip": "clips/golden_028.mp4",
  "frames_dir": "frames/golden_028/",
  "judge_files": {
   "J1": "/opt/gpumachine/projects/video-capability/overnight/数据/judges/glm8/golden_028.json",
   "J5": "/opt/gpumachine/projects/video-capability/overnight/数据/judges/videochat3/golden_028.json",
   "J3": "/opt/gpumachine/projects/video-capability/overnight/数据/judges/omnijev/run_metadata.json",
   "J6": "/opt/gpumachine/projects/video-capability/overnight/数据/judges/detectors/raw/golden_028.qc.json"
  }
 },
 "errors": {}
}