{
 "schema_version": "1.0",
 "clip_id": "golden_033",
 "generated_at": "2026-09-30T18:07:34",
 "qc_mode": "tonight_replay",
 "verdict": {
  "defect_detected": true,
  "decision": "manual_review",
  "confidence": 0.95,
  "decided_by": "E10",
  "reasons": [
   "E10 检出、未达 auto_reject 线：灰区人工复核（J1 检出（无概率通道≥0.90））"
  ]
 },
 "defects": [
  {
   "type": "hand_anomaly",
   "sources": [
    "J1",
    "J2"
   ],
   "confidence": 0.95,
   "evidence": {
    "J1": {
     "notes": "十指交扣特写中手指融合为无指甲无指节的肉团，多个指状凸起无法分离计数，部分指体弯折方向异常，8帧均如此，属典型手部结构崩坏。"
    },
    "J2": {
     "notes": "交扣双手特写指团融合：指节粗细比例异常、拇指状指头重复出现、指数量无法按两手解剖对应"
    }
   }
  },
  {
   "type": "garble_text",
   "sources": [
    "J6"
   ],
   "confidence": 0.85,
   "evidence": {
    "J6": {
     "kind": "uniform_low_conf",
     "conf_src": 0.85
    }
   },
   "span": {
    "start_s": 0.0,
    "end_s": 5.042
   }
  }
 ],
 "scores": {
  "per_type": {
   "frame_freeze": 0.504,
   "flicker": 0.2814,
   "color_shift": 0.5243,
   "face_blur": 0.0565,
   "garble_text": 0.0357,
   "temporal_swap": 0.3682,
   "pixelate": 0.1712,
   "ghosting": 0.5557
  },
  "overall": 0.4716,
  "thresholds_applied": {
   "ensemble_id": "E10",
   "j3_thr": 0.7,
   "auto_reject_p": 0.9,
   "j6_emit_conf": 0.55,
   "thresholds_sha256": "28f192cae0562f89f46a419b768d965aaf1d9298f6678eedfd93d63d2bb06f00"
  }
 },
 "spans": [
  {
   "type": "note",
   "evidence": {
    "text": "全片 f01-f08",
    "source": "J1"
   }
  },
  {
   "type": "note",
   "evidence": {
    "text": "f01/f05/f08 全程",
    "source": "J2"
   }
  },
  {
   "type": "note",
   "evidence": {
    "text": "full_clip:fps=1.0解码",
    "source": "J5"
   }
  }
 ],
 "judges": {
  "J1": {
   "clip_id": "golden_033",
   "defect_detected": true,
   "defect_types": [
    "hand_anomaly"
   ],
   "confidence": 0.95,
   "spans": "全片 f01-f08",
   "notes": "十指交扣特写中手指融合为无指甲无指节的肉团，多个指状凸起无法分离计数，部分指体弯折方向异常，8帧均如此，属典型手部结构崩坏。"
  },
  "J2": {
   "clip_id": "golden_033",
   "defect_detected": true,
   "defect_types": [
    "hand_anomaly"
   ],
   "confidence": 0.7,
   "spans": "f01/f05/f08 全程",
   "notes": "交扣双手特写指团融合：指节粗细比例异常、拇指状指头重复出现、指数量无法按两手解剖对应"
  },
  "J5": {
   "clip_id": "golden_033",
   "defect_detected": false,
   "defect_types": [],
   "confidence": 0.8,
   "spans": "full_clip:fps=1.0解码",
   "notes": "解析=json; 回答={\"defect_types\":[],\"other\":false,\"reason\":\"画面中没有出现任何缺陷\"}"
  },
  "J6": {
   "clip_id": "golden_033",
   "defect_detected": true,
   "defect_types": [
    "garble_text"
   ],
   "confidence": 0.85,
   "spans": [
    {
     "type": "garble_text",
     "start_s": 0.0,
     "end_s": 5.042,
     "evidence": {
      "kind": "uniform_low_conf",
      "max_mean": 0.368
     }
    }
   ]
  },
  "J3": {
   "clip_id": "golden_033",
   "defect_detected": false,
   "defect_types": [],
   "confidence": 0.5557,
   "spans": "16帧4x4拼图 9通道概率（run_metadata.json），阈值 0.70",
   "notes": "frame_freeze=0.504; flicker=0.281; color_shift=0.524; face_blur=0.057; garble_text=0.036; temporal_swap=0.368; pixelate=0.171; ghosting=0.556; overall=0.472"
  }
 },
 "inputs": {
  "clip": null,
  "frames_dir": null,
  "judge_files": {
   "J1": "D:\\workspace\\video-capability-research\\overnight\\数据\\judges\\glm8\\golden_033.json",
   "J2": "D:\\workspace\\video-capability-research\\overnight\\数据\\judges\\glm3\\golden_033.json",
   "J5": "D:\\workspace\\video-capability-research\\overnight\\数据\\judges\\videochat3\\golden_033.json",
   "J6": "D:\\workspace\\video-capability-research\\overnight\\数据\\judges\\detectors\\golden_033.json",
   "J3": "D:\\workspace\\video-capability-research\\overnight\\数据\\judges\\omnijev\\run_metadata.json"
  }
 },
 "errors": {}
}